{
  "$schema": "../../data/schema.json",
  "domain": "example.com",
  "hostname": "wgw02.nyc01",
  "interfaces": {
    "GigabitEthernet1/1": {
      "ipv4": "10.2.0.2/24",
      "role": "uplink"
    },
    "GigabitEthernet1/2": {
      "ipv4": "10.2.0.1/24",
      "role": "uplink"
    },
    "Vlan12": {
      "ipv4": "10.2.1.21/20",
      "role": "security"
    }
  },
  "matches": [],
  "os": "ios",
  "role": "wan-gateway",
  "serial_number": "",
  "tags": [
    "drained"
  ],
  "timezone": "America/New_York",
  "vendor": "cisco"
}
