{
  "$schema": "../schema.json",
  "hostname": "wgw01.nyc01",
  "domain": "example.com",
  "role": "wan-gateway",
  "vendor": "cisco",
  "serial_number": "<asset>",
  "os": "ios",
  "tags": [
    "drained"
  ],
  "timezone": "America/New_York",
  "interfaces": {
    "GigabitEthernet1/1": {
      "ipv4": "10.2.0.1/24",
      "role": "uplink"
    },
    "GigabitEthernet1/2": {
      "ipv4": "<ipam>",
      "role": "uplink"
    },
    "Vlan12": {
      "ipv4": "10.2.1.20/20",
      "role": "security"
    }
  },
  "matches": []
}
